"Authors","Author full names","Author(s) ID","Title","Year","Link","Abstract","Author Keywords"
"Shifna, N.F.; Baalaji, K.; Niharika, P.; Swathi, P.; Krishna, P.R.; Leena, R.","Shifna, N. Fathima Shrene (59007923900); Baalaji, K. (57210600572); Niharika, Pasapala (58175176000); Swathi, P. S. (57262326700); Krishna, Pasangulapati Rama (59662615400); Leena, Reddimala (59661588900)","59007923900; 57210600572; 58175176000; 57262326700; 59662615400; 59661588900","Identifying Machine Generated Tweets: Deepfake Detection on Social Media","2024","https://www.scopus.com/inward/record.uri?eid=2-s2.0-85219344138&partnerID=40&md5=639b0bb642d5cb200b3f666955944a68","In the digital age, the expansion of machine-generated content poses significant challenges to the integrity of online communications. This project addresses the critical issue of detecting fake tweets on Social networking websites platforms by utilizing modern advanced deep learning algorithms and fast text embedded data. Deep fakes, particularly machine-generated text, are becoming increasingly sophisticated, making it essential to develop robust methods for identifying such content. This approach integrates current deep learning models with fast text embedding techniques to differentiate between human-written and machine-generated tweets. These models are fine-tuned to classify tweets based on semantic and syntactic features captured through pre-trained embeddings. Specifically, quick text embeddings in conjunction with convolutional neural networks (CNN) and long short-term memory networks (LSTM) are used to propose a novel approach to deepfake detection using deep learning techniques in this study. Rapid text embeddings strengthen the model's capacity to distinguish between real and fake information by capturing semantic subtleties and contextual linkages in textual data. In order to extract hierarchical features from tweet sequences and to capture temporal dependencies, our approach combines these embeddings with CNNs and LSTMs. Using a dataset of tweets, the suggested method was assessed and found to perform better than conventional techniques in identifying content that was created by machines. © 2024 IEEE.","CNN; Deep learning; Deepfake Detection; Fake tweets; LSTM; Machine-generated content; rapid text embeddings; semantic analysis; syntactic features; Text embeddings"
"Abisha, M.B.; Kathrine, J.W.; Kushmitha, S.","Abisha, M. B. (59511603500); Kathrine, Jaspher W. (57130545500); Kushmitha, S. (59546405800)","59511603500; 57130545500; 59546405800","Capsule Networks and LSTM Models for Robust Deepfake Detection in Audio and Video","2024","https://www.scopus.com/inward/record.uri?eid=2-s2.0-85217181497&partnerID=40&md5=4404f08e4804e94140ad60e8bd904f45","Due to the fast advancement of deepfakes, notable difficulties have been presented by deepfake innovation in confirming the believability of computerized content, especially on the audio and video front. This paper introduces a new hierarchical model that articulates Capsule Networks within LSTM for the effective and robust deepfake detection in both audio-video frameworks. It is argued that using Capsule Networks, spatial mindfulness capabilities enable the detection of subtle spatial objects in video outlines, whereas, LSTM models capture transient objects in audio arrangements and video frames over time. Thus, our approach implements two designs at once that reached progressed discovery accuracy, addressing spatial and temporary disorders, inherent in deepfake media. It is discovered from the outcomes that this model is very much effective on several datasets suggesting its better generalizing capability in different types of Deepfake media. In its current form, the design of this approach seems capable of being used for the real-time detection task. In this regard, this research provides practical insights into the development of media forensics offering an approach that can be more effective in the role of dissemination of fake news prevention, and fills the gap in the current literature, thus advancing the overall understanding of media forensics. © 2024 IEEE.","Audio Deepfake; Audio Pre-processing; Capsule Networks; Data Pre-processing; Deepfake Detection; Digital Content Authenticity; Face and Voice Manipulation; Face-Swapping; Feature Extraction; Long-Term Memory; LSTM Networks; Sequence Analysis; Video Deepfake; Video Frame Extraction; Voice Synthesis"
"Koritala, S.P.; Chimata, M.; Polavarapu, S.N.; Vangapandu, B.S.; Gogineni, T.K.; Manikandan, V.M.","Koritala, Sai Pragna (59483790200); Chimata, Mahitha (59172107400); Polavarapu, Sai Naren (59483514800); Vangapandu, Bhavya Sri (59484181200); Gogineni, Tarun Krishna (59298629400); Manikandan, V. M. (58626529300)","59483790200; 59172107400; 59483514800; 59484181200; 59298629400; 58626529300","A Deepfake detection technique using Recurrent Neural Network and EfficientNet","2024","https://www.scopus.com/inward/record.uri?eid=2-s2.0-85212870064&partnerID=40&md5=277d7f9d9582cb79c45cfb024c56dd83","A deepfake is a computer-generated image or video that appears to be real but is a fabricated representation created to make an individual appear to be saying or doing something that did not occur. Deepfakes generate misleading or deceptive information by manipulating and superimposing faces onto pre-existing footage using artificial intelligence. This paper introduces a novel approach for deepfake detection through a combination of EfficientNet and Recurrent Neural Networks (RNNs). This method enhances detection efficiency by leveraging the hierarchical features acquired by EfficientNet and employing RNNs, specifically Long Short-Term Memory (LSTM) networks, to capture temporal dependencies. Application of this approach to the Celeb-DF dataset resulted in an accuracy of 99.98%. ©2024 IEEE.","Deepfake detection; EfficientNet; LSTM; Recurrent Neural Network(RNN)"
"Tantawy, O.; Elshafee, A.","Tantawy, Omar (59480817300); Elshafee, Ahmed M. (14031411900)","59480817300; 14031411900","Advancements in Deepfake Detection: Leveraging Bi-LSTM-CNN Architecture for Robust Identification","2024","https://www.scopus.com/inward/record.uri?eid=2-s2.0-85212584890&partnerID=40&md5=078a246c7d232e426e78cdad080bcaab","In our modern era, the saying 'visual evidence is conclusive' no longer holds true, presenting significant implications across various spheres of our lives. With the rapid advancement of technology, the creation of synthetic media, particularly deepfakes, has become remarkably facile. Some applications even facilitate the creation of deepfakes directly on handheld devices. The identification of deepfakes poses a formidable challenge as they can be imperceptible to the human eye. Nevertheless, researchers are actively engaged in developing methodologies to discern deepfakes. Deepfakes constitute media generated through AI algorithms. These algorithms assimilate attributes from a reference image and overlay them onto a source image. In our pursuit of identifying video deepfakes, we employ deep learning architectures such as Bi-LSTM integrated with CNN. Our approach capitalizes on 50 epochs of training to attain a remarkable accuracy of up to 98.7%. We leverage transfer learning to construct a robust deepfake detection model. Initially, we utilize a pretrained CNN, dubbed Bi-LSTM-CNN, to extract salient features and construct feature vectors. Subsequently, the Bi-LSTM layer is trained using these feature vectors. The resulting confusion matrix substantiates the efficacy of our model, with validation and testing accuracies reaching an impressive level. © 2024 IEEE.","Advancements in Deepfake Detection; Leveraging Bi-LSTM-CNN Architecture for Robust Identification"
"Li, R.; Yin, H.; Li, Y.; Li, H.","Li, Ruotong (59415767300); Yin, Huanpu (56984958900); Li, Yan (59415648900); Li, Haisheng (55707571100)","59415767300; 56984958900; 59415648900; 55707571100","V3CViT: Deepfake Detection Based on Video Vision Transformer and 3D Convolution Network","2024","https://www.scopus.com/inward/record.uri?eid=2-s2.0-85209570938&partnerID=40&md5=d3d6b7e5ea7915470d42cd7e0fb69fa4","With the advancement of Generative Adversarial Networks in synthesizing fake face videos, the proliferation of forged products poses a significant threat to societal security. In video-based detection methods, compression operations cause the disappearance of discriminative features, and the use of deep learning methods often overlooks the interrelationships between features, resulting in limited model generalization. Therefore, we propose a deepfake video detection framework named V3CViT. This framework combines a video vision transformer and 3D convolutional neural networks to extract facial features, capturing facial characteristics in both temporal and spatial dimensions and combining them to extract effective features using attention mechanisms. Subsequently, the structured facial feature maps are utilized with a Gated Graph Convolutional Network to learn facial relationship information for the detection task. The experiments show that compared to existing detection methods, our model can comprehensively capture facial features in forged videos and achieves more significant accuracy on the mixed dataset. © The Author(s), under exclusive license to Springer Nature Singapore Pte Ltd. 2024.","Deepfake detection; Facial relationship learning; Spatio-temporal modeling; Video vision transformer"
"Vaidya, A.O.; Dangore, M.; Borate, V.K.; Raut, N.; Mali, Y.K.; Chaudhari, A.","Vaidya, Anusha Omkar (58909155800); Dangore, Monika Y. (56029154700); Borate, Vishal Kisan (56642826300); Raut, Nutan (59397701500); Mali, Yogesh Kisan (25723576800); Chaudhari, Ashvini R. (57289544700)","58909155800; 56029154700; 56642826300; 59397701500; 25723576800; 57289544700","Deep Fake Detection for Preventing Audio and Video Frauds Using Advanced Deep Learning Techniques","2024","https://www.scopus.com/inward/record.uri?eid=2-s2.0-85208283475&partnerID=40&md5=c6b295f59e6d76c28be156c4079d15cb","Deepfakes allow for the automated gen- eration of fake video content, often accomplished through the use of generative adversarial networks. To address the increasing issue of deepfakes, this study focuses on constructing a model that incorporates advanced techniques. The researchers combined the ResNeXt, Long Short-Term Memory (LSTM), and ResNet architectures, selecting them based on their effectiveness in handling complex visual data and capturing temporal dependencies. Prior to detection, the dataset underwent pre-processing using the Multi-Task Cascaded Convolutional Neural Network (MTCNN), which facilitated the accurate extraction of facial regions. Importantly, the study evaluated the model across three diverse and significant datasets: the Face Forensics++ dataset (FF-DF), the Celeb-DF dataset, and the Facebook Deepfake Detection Challenge (DFDC) dataset. This comprehensive evaluation en- sured the model's ability to generalize and its suitability for real-world scenarios, as demonstrated by its exceptional detection accuracy. The combination of models employed in this study yielded highly accurate results and remained robust in the face of evolving deepfake technology. © 2024 IEEE.","CelebDF; Detection Accuracy; DFDC; Face Forensics++; LSTM; Model Architecture; MultiTask Cascaded Convolutional Neural Network (MTCNN); Preprocessing; ResNet; ResNeXt"
"Chowdary, B.V.; Prabhakar, M.; Akhil, M.; Pavan, K.; Teja Reddy, B.P.T.","Chowdary, B. V. (57443139500); Prabhakar, Marry (59363403100); Akhil, Mavoori (58981882800); Pavan, Komirishetty (58981322700); Teja Reddy, B. Pavana (58982437500)","57443139500; 59363403100; 58981882800; 58981322700; 58982437500","Deep Fake Detection using Adversarial Ensemble Techniques","2024","https://www.scopus.com/inward/record.uri?eid=2-s2.0-85206120130&partnerID=40&md5=a778e07a417adba34b5780d6ca6bc66f","The rise of deepfake technology has resulted in unprecedented challenges in the field of digital media verification, posing significant threats to personal security, misinformation, and trust in digital content. In response to this pressing issue, this study presents an advanced deepfake detection system using deep learning approach. Specifically, the proposed system integrates ResNeXt and Long Short-Term Memory (LSTM) architectures to accurately identify the manipulated content. By leveraging the spatial-temporal features captured by these combined architectures, the proposed system aims to enhance the detection rate of deepfakes across various media formats. The proposed approach offers a robust solution to counteract the evolving sophistication of deepfake technology, thereby enhancing the integrity and authenticity of digital media content. © 2024 IEEE.","Deep Learning; Deepfake Detection; Digital Media Verification; LSTM; ResNeXt"
"Teng, H.; Lin, C.-Y.","Teng, Hao (59357743000); Lin, Chia Yu (57129215700)","59357743000; 57129215700","Dynamic and Static Features Extraction for Deepfake Detection","2024","https://www.scopus.com/inward/record.uri?eid=2-s2.0-85205815704&partnerID=40&md5=edc739d0d147b57c85a0dfe83445d62e","Deepfake has emerged as a significant concern due to its ability to generate fake images and synthesize realistic videos. The increasing development of new techniques for deep-fake creation raises concerns about the cross-forgery issue. Cross-forgery indicates that a model is initially trained to recognize a particular fake and must work against a different unknown forgery. Training a model needs substantial quantities of data, a challenge compounded if the deepfake generation technique is relatively new. Addressing cross-forgery is a critical and essential challenge that requires resolution. In order to solve cross-forgery, our effort presents a method that combines dynamic and static features to identify forgery. For the static component, we extract features similar to general deepfake detection techniques using a single RGB frame as input. Simultaneously, we utilize optical flow analysis to capture changes between consecutive frames for the dynamic part. Our experiments reveal a clear advantage in utilizing combined features, which is particularly evident in cross-forgery scenarios. Specifically, when encountering certain categories, the performance improvement is significant, demonstrating four times better than single-feature models. © 2024 IEEE.","Deepfake detection; multimodel; optical flow; vision transformer"
"She, H.; Hu, Y.; Liu, B.; Li, J.; Li, C.-T.","She, Huimin (58504567900); Hu, Yongjian (35766130600); Liu, Beibei (55544736500); Li, Jicheng (57201859261); Li, Chang Tsun (26648782200)","58504567900; 35766130600; 55544736500; 57201859261; 26648782200","Using Graph Neural Networks to Improve Generalization Capability of the Models for Deepfake Detection","2024","https://www.scopus.com/inward/record.uri?eid=2-s2.0-85202750625&partnerID=40&md5=7402f969a1c0852df0b00c7435ca4ba5","Deepfake detection plays a key role in preventing the misuses of artificial intelligence in video editing. Current deep learning-based deepfake detection methods often perform quite well in intra-dataset testing, but they may lose good performance in cross-dataset testing. In other words, generalization capability is still a crucial problem to be resolved. In this paper, we address deepfake detection by treating an image as non-Euclidean data and representing it as a graph so as to infer the informative connections between image patches/nodes to improve the detector's generalization capability. Specifically, we propose a graph neural network-based paradigm that casts deepfake detection as a graph binary classification problem. First, we propose a dual-branch network to extract node features from both RGB images and their color difference images (CDIs) via the Transformer-based trainable node encoder module (TNEM). Second, we adopt the adjacency matrix to establish the connections of the nodes and further optimize the graph representation by applying the adaptive threshold to the adjacency matrix. Third, multi-head graph convolutional neural networks are carried out for node feature extraction. RGB node features and CDI node features are concatenated and separately fed into the graph classifier and node classifier for forgery detection and forgery localization. Experimental results demonstrate that our method can overall outperform other state-of-the-art methods on 7 popular benchmark datasets. Notably, our model achieves the highest AUC values of 96.19%, 80.99% and 87.68% on Celeb-DF-V2, DFDC and DFDCP in turn when trained on FF++ (C23). The visualization of node classification results also provides good interpretability of our proposed approach. © 2005-2012 IEEE.","color difference; Deepfake detection; generalization; graph classification; graph neural network; transformer"
"Vignesh, T.; Tarun, P.H.; Parthav, R.; Bhargavi, V.","Vignesh, Thipparthi (59297471800); Tarun, Potharlanka Harish (58420512500); Parthav, Ryagalla (59172007300); Bhargavi, V. (59397740800)","59297471800; 58420512500; 59172007300; 59397740800","DeepFake Face Detection using Machine Learning with LSTM","2024","https://www.scopus.com/inward/record.uri?eid=2-s2.0-85195980968&partnerID=40&md5=0f998366ff82456671b6f5178c4da6c9","Fake face images that are increasingly convincing and realistic can be created because to the development of face image manipulation (FIM) technologies like Face to Face and Deepfake, which can damage the legitimacy and trustworthiness of online content. Malicious uses of these technology include blackmailing people, posing as celebrities, and disseminating false information. As a result, creating trustworthy and strong techniques to identify FIM and safeguard the integrity of digital media is essential. Numerous current techniques utilize on models built on convolutional neural networks (CNNs), which are capable of detecting FIM by examining a face's visual characteristics. But because these models are frequently tested and trained on certain datasets or circumstances. Furthermore, they might not be able to record the temporal information that is included in video data and can be used to identify irregularities or strange anomalies in FIM videos. We provide a novel method that uses both geographical and temporal information to detect FIM in order to get over these difficulties. We present a new type of residual network called CRNet, which is dependent on Convolutional Long Short-Term Memory (LSTM) and is capable of processing a series of consecutive pictures taken from a movie. The model can learn temporal information because to its design, which is essential for spotting oddities that occur in between frames of FIM movies. We performed extensive tests with several kinds of FIM videos from the Kaggle dataset. © 2024 IEEE.","Deepfake detection; Image manipulation; Kaggle; Long-Short Term Memory (LSTM); Residual next convolution neural network (Xception CNN)"
"Chen, T.; Yang, S.; Hu, S.; Fang, Z.; Fu, Y.; Wu, X.; Wang, X.","Chen, Tiewen (58897683400); Yang, Shanmin (57208777244); Hu, Shu (57221150967); Fang, Zhenghan (57204103923); Fu, Ying (55712884400); Wu, Xi (59463954300); Wang, Xin (57225117859)","58897683400; 57208777244; 57221150967; 57204103923; 55712884400; 59463954300; 57225117859","Masked Conditional Diffusion Model for Enhancing Deepfake Detection","2024","https://www.scopus.com/inward/record.uri?eid=2-s2.0-85188605005&partnerID=40&md5=fc750cb056a49708d96b4e544adbb36c","Recent studies on deepfake detection have achieved promising results when training and testing faces are from the same dataset. However, their results severely degrade when confronted with forged samples that the model has not yet seen during training. In this paper, deepfake data to help detect deepfakes. this paper present we put a new insight into diffusion model-based data augmentation, and propose a Masked Conditional Diffusion Model (MCDM) for enhancing deepfake detection. It generates a variety of forged faces from a masked pristine one, encouraging the deepfake detection model to learn generic and robust representations without overfitting to special artifacts. Extensive experiments demonstrate that forgery images generated with our method are of high quality and helpful to improve the performance of deepfake detection models. © 2024 IEEE.","Conditional Diffusion Model; Data Augmentation; Deepfake Detection"
"Guo, Z.; Li, Z.; Peng, Y.; Kong, X.","Guo, Ziteng (59730425400); Li, Zehang (60098998100); Peng, Yingshan (60094078900); Kong, Xinyu (60098854400)","59730425400; 60098998100; 60094078900; 60098854400","Research on Real-Time Deepfake Image Detection System Based on a Self-Supervised Learning Framework","2024","https://www.scopus.com/inward/record.uri?eid=2-s2.0-105016014846&partnerID=40&md5=1851e535d71533f5f1c8507d0139ae19","The rapid evolution of deepfake technology raises significant security and ethical concerns, as its potential misuse could lead to the spread of disinformation. In this study, we propose an advanced real-time deepfake image detection system based on a self-supervised learning framework. The model is based on the most advanced visual transformers (ViTs) and integrates contrastive representation learning in order to effectively distinguish between manipulated content and real images. Furthermore, we have incorporated a temporal consistency module that leverages subtle temporal artefacts to enhance the precision of detection, particularly in video frame sequences. The architectural design is devised to capture spatial and temporal anomalies, thereby ensuring robust detection performance in real-time scenarios. The experimental outcomes on benchmark datasets of Celeb-DF demonstrate that the proposed model exhibits a notable superiority to the existing deepfake detection methods in terms of accuracy and efficiency. © 2024 IEEE.","Contrast means learning; Deepfake detection; self-supervised learning; Visual Transformers"
"Singh, D.; Singh, P.; Bhandari, R.","Singh, Deepanshu (59472338700); Singh, Prabhdeep (58728154000); Bhandari, Rahul (57201373110)","59472338700; 58728154000; 57201373110","A Comprehensive Review of Deepfake Detection In Advanced Neural Network Architectures and Deep Learning Strategies","2024","https://www.scopus.com/inward/record.uri?eid=2-s2.0-105003299521&partnerID=40&md5=b1d1bb7b215a1aa9abb9cd117796594e","The proliferation of deepfakes, facilitated by advancements in machine learning and artificial intelligence, poses a significant challenge to online security and information integrity. This study reviews current deep fake detection techniques, focusing on methodologies for identifying manipulated content in images, audio, and video. 17 articles were selected for this study using Prisma guidelines. The function of sophisticated machine learning models, such as Long Short-Term Memory (LSTM) networks and (CNNs), is highlighted for automating detection processes. The review also examines notable algorithms and datasets, including FaceForensics++, MesoNet, and XceptionNet, and their effectiveness in enhancing detection accuracy. A case study using frame extraction and resizing techniques demonstrates a detection accuracy of 62%, with precision at 61 %, recall at 63%, and an F1 score of 62% is also included. The findings underscore the need for ongoing refinement and adaptation of detection systems to counteract the evolving nature of deepfake technologies. The study providing thorough overview of the state-of-the-art in deepfake detection, offering insights into effective methodologies and future research directions. © 2024 IEEE.","CNNs; Deepfake detection; Digital media integrity; DL; Generative adversarial networks(GAN); Introduction; LSTMs; Machine learning; Misinformation detection; Neural network fusion; Spatial-temporal features; Video analysis"
