"Authors","Author full names","Author(s) ID","Title","Year","Link","Abstract","Author Keywords"
"Zheng, W.; Zhou, F.; Ling, X.","Zheng, Wei (59247394600); Zhou, Fandi (57211124854); Ling, Xia (58663236700)","59247394600; 57211124854; 58663236700","FETNet: frequency-enhanced transformer network for face forgery detection","2024","https://www.scopus.com/inward/record.uri?eid=2-s2.0-85200446956&partnerID=40&md5=787f45b16f351231eb25397cee67307f","With the development of deepfake methods, a large number of deepfake images and videos have been widely disseminated on the internet, raising public concerns about the authenticity of information. Therefore, deepfake detection has recently become a hot topic in the field of computer vision, and many methods have been proposed. Currently, frequency-based detection methods have achieved commendable results, but there are still two issues: a) These methods use fixed filters to focus on fixed frequency bands and areas, making them easily distracted by irrelevant information and lacking flexibility for different forgery methods. b) The methods that fuse frequency domain information with RGB information using CNNs do not consider global relationships, so they are insufficient to fully utilize both types of information. To address these issues, we introduce a Frequency-Enhanced Transformer Network (FETNet). Specifically, we propose a Frequency Feature Enhancement Module (FFEM), which is a learnable module capable of flexibly enhancing important frequency bands and regions in the original frequency features. Additionally, we present a Feature Fusion Transformer (FFT) that considers global information to fuse features from the RGB and frequency domains, achieving a more comprehensive feature representation. Through extensive experiments on the FF++ dataset, the effectiveness and superiority of our approach have been demonstrated. © 2024 SPIE.","convolutional neural networks; Deepfake detection; transformer"
"Sabareshwar, D.; Raghul, S.; Ravi, S.; Varalakshmi, M.; Peer Mohamed, P.U.","Sabareshwar, D. (59091564800); Raghul, Siva Venkatesh (59173430100); Ravi, Shawn (59091000700); Varalakshmi, Murugesan (58286484600); Peer Mohamed, P. U. (59091564900)","59091564800; 59173430100; 59091000700; 58286484600; 59091564900","A Lightweight CNN for Efficient Deepfake Detection of Low-resolution Images in Frequency Domain","2024","https://www.scopus.com/inward/record.uri?eid=2-s2.0-85192564021&partnerID=40&md5=1f64c10f3ffbf3e32b63388365b6ad2b","Deepfake detection in frequency domain is extensively explored for two reasons -artifacts generated by the up-sampling layer of Generative Adversarial Networks are more prominent in the frequency domain and some image processing tasks are simpler and efficient in this domain. Traditional convolutional neural networks outperform the machine learning models for their ability to detect deepfakes of low-resolution images also. But these networks involve numerous trainable parameters resulting in huge computation cost, time and high memory requirements. This paper presents a lightweight Convolutional Neural Network (CNN) architecture that is optimized for efficient deepfake detection of low-resolution images in the frequency domain. The proposed model achieves almost the same accuracy as that of the traditional network but with the parameter requirement reduced by 92%. This renders the model suitable for use in memory-constrained and power-constrained environments such as mobile devices and other embedded systems. © 2024 IEEE.","Deepfake detection; depthwise separable convolution; frequency domain; lightweight CNN; pixel domain"
"Zhou, J.; Zhao, X.; Xu, Q.; Zhang, P.; Zhou, Z.","Zhou, Jiting (57195986446); Zhao, Xinrui (58985251300); Xu, Qian (58440887000); Zhang, Pu (58985170000); Zhou, Zhihao (58985328800)","57195986446; 58985251300; 58440887000; 58985170000; 58985328800","MDCF-Net: Multi-Scale Dual-Branch Network for Compressed Face Forgery Detection","2024","https://www.scopus.com/inward/record.uri?eid=2-s2.0-85190741441&partnerID=40&md5=a0255f8bc105db4d309efd332569beaf","Face forgery detection aims to identify manipulated or altered facial images or videos created using artificial intelligence. Existing detection methods exhibit favorable performance on high-quality videos, but the videos in daily applications are commonly compressed into low-quality formats via social media. The detection difficulty is increased by the poor quality, indistinct detail features, and noises such as artifacts in these images or videos. To address this challenge, we propose a multi-scale dual-branch network for compressed face forgery, called MDCF-Net, effectively capturing cross-domain forgery features at various scales in compressed facial images. The MDCF-Net comprises two branches: an RGB domain branch utilizing Transformers to extract multi-scale fine-texture features from the original RGB images; a frequency domain branch designed to capture artifacts in low-quality videos by extracting global spectral features as a supplementary measure. Then, we introduce a feature fusion module (FFM) based on multi-head attention to merge diverse feature representations in a spatial-frequency complementary manner. Extensive comparative experiments on public datasets such as FaceForensics++, Celeb-DF, and WildDeepfake demonstrate the significant advantage of MDCF-Net in detecting highly compressed and low-quality forged images or videos, especially in achieving state-of-the-art performance on the FaceForensics++ low-quality dataset. Our approach presents a new perspective and technology for low-quality face forgery detection. © 2013 IEEE.","deepfake detection; Face forgery; feature fusion; frequency domain; transformers; two-branch"
"Huang, Y.; Juefei-Xu, F.; Guo, Q.; Liu, Y.; Pu, G.","Huang, Yihao (57214756217); Juefei-Xu, Felix (54911989900); Guo, Qing (57191163500); Liu, Yang (56911879800); Pu, Geguang (9534351100)","57214756217; 54911989900; 57191163500; 56911879800; 9534351100","Dodging DeepFake Detection via Implicit Spatial-Domain Notch Filtering","2024","https://www.scopus.com/inward/record.uri?eid=2-s2.0-85174804409&partnerID=40&md5=a242998df0464825f77222b053b8e7a4","The current high-fidelity generation and high-precision detection of DeepFake images are at an arms race. We believe that producing DeepFakes that are highly realistic and 'detection evasive' can serve the ultimate goal of improving future generation DeepFake detection capabilities. In this paper, we propose a simple yet powerful pipeline to reduce the artifact patterns of fake images without hurting image quality by performing implicit spatial-domain notch filtering. We first demonstrate that frequency-domain notch filtering, although famously shown to be effective in removing periodic noise in the spatial domain, is infeasible for our task at hand due to the manual designs required for the notch filters. We, therefore, resort to a learning-based approach to reproduce the notch filtering effects, but solely in the spatial domain. We adopt a combination of adding overwhelming spatial noise for breaking the periodic noise pattern and deep image filtering to reconstruct the noise-free fake images, and we name our method DeepNotch. Deep image filtering provides a specialized filter for each pixel in the noisy image, producing filtered images with high fidelity compared to their DeepFake counterparts. Moreover, we also use the semantic information of the image to generate an adversarial guidance map to add noise intelligently. Our large-scale evaluation on 3 representative DeepFake detection methods (tested on 16 types of DeepFakes) has demonstrated that our technique significantly reduces the accuracy of these 3 fake image detection methods, 36.79% on average and up to 97.02% in the best case. © 1991-2012 IEEE.","DeepFake; DeepFake detection; DeepFake evasion"
"Sen, L.; Mukherjee, S.","Sen, Lord (59761169400); Mukherjee, Shyamapada (59037257500)","59761169400; 59037257500","A Novel Unified Approach to Deepfake Detection of Images","2024","https://www.scopus.com/inward/record.uri?eid=2-s2.0-105003907847&partnerID=40&md5=18bb2c35a0784c60b338a10f47f8cb6a","The advancements in the field of AI is increasingly giving rise to various threats. One of the most prominent of them is the synthesis and misuse of Deep Fakes. To sustain trust in this digital age, detection and tagging of deepfakes is very necessary. In this paper, a novel architecture for Deepfake detection in images is presented. The architecture uses cross-attention between spatial and frequency domain features along with a blood detection module to classify an image as real or fake. This paper aims to develop a unified architecture and provide insights into each step. It is trained on two small datasets with 200 and 400 images respectively. On comparative analysis, our model was better than the other possibilities. Further, there was an increment in accuracy of 4.29% and 4.60% upon adding 200 images to the dataset. This shows that, if trained on a large dataset and hyper-parameters optimized, the performance will increase significantly. © 2024 IEEE.","Cross Attention; DeepFake detection; Fourier Transform etc"
"Wang, F.; Chen, Q.; Jing, B.; Tang, Y.; Song, Z.; Wang, B.","Wang, Fei (58366999700); Chen, Qile (59750265200); Jing, Botao (59336619000); Tang, Yeling (58120138500); Song, Zengren (57367945900); Wang, Bo (57216234699)","58366999700; 59750265200; 59336619000; 58120138500; 57367945900; 57216234699","Deepfake Detection Based on the Adaptive Fusion of Spatial-Frequency Features","2024","https://www.scopus.com/inward/record.uri?eid=2-s2.0-105003150882&partnerID=40&md5=451678173b529f075493173354472720","Detecting deepfake media remains an ongoing challenge, particularly as forgery techniques rapidly evolve and become increasingly diverse. Existing face forgery detection models typically attempt to discriminate fake images by identifying either spatial artifacts (e.g., generative distortions and blending inconsistencies) or predominantly frequency-based artifacts (e.g., GAN fingerprints). However, a singular focus on a single type of forgery cue can lead to limited model performance. In this work, we propose a novel cross-domain approach that leverages a combination of both spatial and frequency-aware cues to enhance deepfake detection. First, we extract wavelet features using wavelet transformation and residual features using a specialized frequency domain filter. These complementary feature representations are then concatenated to obtain a composite frequency domain feature set. Furthermore, we introduce an adaptive feature fusion module that integrates the RGB color features of the image with the composite frequency domain features, resulting in a rich, multifaceted set of classification features. Extensive experiments conducted on benchmark deepfake detection datasets demonstrate the effectiveness of our method. Notably, the accuracy of our method on the challenging FF++ dataset is mostly above 98%, showcasing its strong performance in reliably identifying deepfake images across diverse forgery techniques. © © 2024 Fei Wang et al.","adaptive fusion; deepfake detection; spatial and frequency domain; wavelet transform"
"Liu, T.; Liu, Y.; Li, N.; Shi, H.","Liu, Tianju (59704205900); Liu, Yuan (59340657400); Li, Ningyi (59704751000); Shi, Hui (55448237600)","59704205900; 59340657400; 59704751000; 55448237600","Multi-domain Multi-scale DeepFake Detection for Generalization","2024","https://www.scopus.com/inward/record.uri?eid=2-s2.0-105002319701&partnerID=40&md5=543d4af17a241a0383f2a75b5483935c","As deepfake detection technology progresses and application scenarios broaden, it becomes challenging for detection models within a single domain or single scale to handle the complex application environments, leading to limited accuracy and generalization capabilities of the detection models. To address the above problems, we propose a Multi-domain Multi-scale DeepFake Detection model. First, we employ the RetinaFace framework to preprocess and augment the image data, which directs the model's attention to the relevant regions of the image. Next, we utilize the EfficientNet-B0 network for rapid coarse-grained feature extraction. Building on these coarse-grained features, we design two modules to capture forgery traces at multiple levels: a spatial-domain fine-grained feature extraction module based on multi-scale analysis and a frequency-domain fine-grained feature extraction module leveraging the Fast Fourier Transform. Finally, the dual-domain features are fused using a multi-channel attention mechanism, enabling the model to comprehensively analyze images from various perspectives. Additionally, we implement a Particle Swarm Optimization (PSO) strategy to optimize the hyper-parameters of the network model. The proposed model demonstrates significant advantages over other algorithms, particularly in cross-dataset detection, exhibiting strong generalization, robustness, and adaptability. When trained on the FF++ dataset and tested on the Celeb-DF dataset, it achieves an AUC of 91.7%. This represents a 14.8% improvement in cross-dataset performance compared to the best existing model. © 2024 IEEE.","Data Preprocessing and Augmentation; DeepFake Detection; Generalization; Multi-domain Multi-scale; P article Swarm Optimization"
"Wu, J.; Zhang, B.; Li, Z.; Pang, G.; Teng, Z.; Fan, J.","Wu, Jianghao (58260652500); Zhang, Baopeng (57211546343); Li, Zhaoyang (58084749500); Pang, Guilin (57202025774); Teng, Zhu (36553668200); Fan, Jianping (57220794072)","58260652500; 57211546343; 58084749500; 57202025774; 36553668200; 57220794072","Interactive Two-Stream Network Across Modalities for Deepfake Detection","2023","https://www.scopus.com/inward/record.uri?eid=2-s2.0-85159670945&partnerID=40&md5=7c9a44d4eb64d4a023c5088f157740ac","As face forgery techniques have become more mature, the proliferation of deepfakes may threaten the security of human society. Although existing deepfake detection methods achieve good performance for in-dataset evaluation, it remains to be improved in the generalization ability, where the representation of the imperceptible artifacts plays a significant role. In this paper, we propose an Interactive Two-Stream Network (ITSNet) to explore the discriminant inconsistency representation from the perspective of cross-modality. In particular, the patch-wise Decomposable Discrete Cosine Transform (DDCT) is adopted to extract fine-grained high-frequency clues, and information from different modalities communicates with each other via a designed interaction module. To perceive the temporal inconsistency, we first develop a Short-term Embedding Module (SEM) to refine subtle local inconsistency representation between adjacent frames, and then a Long-term Embedding Module (LEM) is designed to further refine the erratic temporal inconsistency representation from the long-range perspective. Extensive experimental results conducted on three public datasets show that ITSNet outperforms the state-of-the-art methods both in terms of in-dataset and cross-dataset evaluations. © 2023 IEEE.","cross-modality learning; Deepfake detection; inconsistency representation"
"Kingra, S.; Aggarwal, N.; Kaur, N.","Kingra, Staffy (57192255022); Aggarwal, Naveen (36875216400); Kaur, Nirmal (57189220908)","57192255022; 36875216400; 57189220908","SiamNet: Exploiting source camera noise discrepancies using Siamese Network for Deepfake Detection","2023","https://www.scopus.com/inward/record.uri?eid=2-s2.0-85163196991&partnerID=40&md5=0a1d12c675526a544737a4808469475a","Recent advancements in deep neural networks especially GAN (Generative Adversarial Network) have resulted in the creation of more realistic deepfake media. This technology can swap the source person's face or alter facial expressions in an image or video; Media manipulated in such a way is termed deepfake. This type of manipulated media poses potential risks to journalism, politics, court proceedings and various social aspects. While existing approaches concentrate on the use of deep neural networks to directly extract facial artefacts for deepfake detection, they do not examine subtle inconsistencies in/across frame/frames. Moreover, state-of-the-art deepfake detection networks appear more complex and tend to overfit on specific artefacts which limits their generalizability on unseen data. This paper proposed a novel technique that tackles the problem of manipulated face detection in videos and images by exploiting the noise pattern inconsistency amongst face region and rest of the frame. To enable a comparison between the noise patterns of these two regions, we propose a two-stream Siamese-like network called SiamNet. This network can extract the noise patterns of the face region and patch through separate streams without increasing the number of parameters, thereby enhancing its efficiency and effectiveness. Each branch consists of pretrained Inception-v3 architecture for camera noise extraction. Siamese training is utilized to compare both noise patterns computed through different base models. The proposed two-branch network, SiamNet is found efficient for several large-scale deepfake datasets such as FF++, Celeb-DF, DFD and DFDC achieving accuracy rates of 99.7%, 98.3%, 96.08% and 89.2% respectively. Furthermore, the proposed technique exhibits greater generalizability and outperforms state-of-the-art of deepfake detection methods. Performance of the proposed model is also evaluated on FaceForensics benchmark dataset against different approaches. © 2023 Elsevier Inc.","Camera noise; Deepfake detection; Face-patch; Facial manipulation detection; Video forensics"
"Liang, Y.; Wang, M.; Jin, Y.; Pan, S.; Yong, Y.","Liang, Yufei (57547903500); Wang, Mengmeng (57193745284); Jin, Yining (57224528340); Pan, Shuwen (7402713446); Yong, Liu (56011543900)","57547903500; 57193745284; 57224528340; 7402713446; 56011543900","Hierarchical supervisions with two-stream network for Deepfake detection","2023","https://www.scopus.com/inward/record.uri?eid=2-s2.0-85162908018&partnerID=40&md5=6403886f30c80d8770c356a2f008d15c","Recently, the quality of face generation and manipulation has reached impressive levels, making it difficult even for humans to distinguish real and fake faces. At the same time, methods to distinguish fake faces from reals came out, such as Deepfake detection. However, the task of Deepfake detection remains challenging, especially the low-quality fake images circulating on the Internet and the diversity of face generation methods. In this work, we propose a new Deepfake detection network that could effectively distinguish both high-quality and low-quality faces generated by various generation methods. First, we design a two-stream framework that incorporates a regular spatial stream and a frequency stream to handle the low-quality problem since we find that the frequency domain artifacts of low-quality images will be preserved. Second, we introduce hierarchical supervisions in a coarse-to-fine manner, which consists of a coarse binary classification branch to classify reals and fakes and a five-category classification branch to classify reals and four different types of fakes. Extensive experiments have proved the effectiveness of our framework on several widely used datasets. © 2023","Coarse to fine; Deepfake detection; Frequency domain; Two stream"
"Yang, G.; Wei, A.; Fang, X.; Zhang, J.","Yang, Gaoming (36976637300); Wei, Anxing (58134348700); Fang, Xianjin (26423619800); Zhang, Ji (57225122203)","36976637300; 58134348700; 26423619800; 57225122203","FDS_2D: rethinking magnitude-phase features for DeepFake detection","2023","https://www.scopus.com/inward/record.uri?eid=2-s2.0-85160813488&partnerID=40&md5=7288cdb376c5c564646436e58cc35c99","To reduce the harm of forged information, more and more detection methods use frequency domain information. They mostly take spectra as clues to identify fake content. However, the current work tends to use only one of the magnitude and phase spectra for learning. In this paper, we notice that the magnitude and phase spectrum contain different image information. Only one spectrum is easily disturbed by noise, and the robustness of the method is difficult to guarantee. Therefore, we propose the Frequency Domain Separable DeepFake Detection (FDS_2D), which is a multi-branch network to obtain features in different frequency spectra. In FDS_2D, the spectral information is divided into three categories: the magnitude spectrum, the phase spectrum, and the relationship between the two spectra. According to their characteristics, we design independent modules for feature extraction from them. Moreover, to improve the utilization efficiency of multi-features, we propose a multi-input multi-output attention mechanism for information interaction between branches. The experimental results show that each part of FDS_2D effectively extracts and applies spectral information; The comprehensive performance of our model is verified on FaceForensic + + , Celeb-DF, and DFDC. It proves that the ability of FDS_2D to detect DeepFake is not inferior to existing models. © 2023, The Author(s), under exclusive licence to Springer-Verlag GmbH Germany, part of Springer Nature.","DeepFake detection; Frequency; Magnitude spectra; Phase spectra; Spectrum relationship"
"Pang, G.; Zhang, B.; Teng, Z.; Qi, Z.; Fan, J.","Pang, Guilin (57202025774); Zhang, Baopeng (57211546343); Teng, Zhu (36553668200); Qi, Zige (58087970800); Fan, Jianping (57220794072)","57202025774; 57211546343; 36553668200; 58087970800; 57220794072","MRE-Net: Multi-Rate Excitation Network for Deepfake Video Detection","2023","https://www.scopus.com/inward/record.uri?eid=2-s2.0-85147287860&partnerID=40&md5=320fa9985e9013574dca4cc987676a59","The current social media is flooded with hyper realistic face-synthetic videos due to the explosion of DeepFake technology that has brought a serious impact on human society security, which calls for further exploring on deepfake video detection methods. Existing methods attempt to isolated capture spatial artifacts or extract the homogeneous temporal inconsistency to detect deepfake video, but little attention has been paid to the exploitation of dynamic spatial-temporal inconsistency. To mitigate this issue, in this paper, we propose a novel Multi-Rate Excitation Network (MRE-Net) to effectively excite dynamic spatial-temporal inconsistency from the perspective of multiple rates for deepfake video detection. The proposed MRE-Net is composed of two components: Bipartite Group Sampling (BGS) and multiple rate branches. The BGS draws the entire video into multiple bipartite groups with different rates to cover various face motion dynamic evolution. We further design multiple rate branches to capture both short-term and long-term spatial-temporal inconsistency from corresponding bipartite groups of BGS. Concretely, for the early stages of the multi-rate branches, Momentary Inconsistency Excitation (MIE) module is developed to encode the spatial artifacts and intra-group short-term temporal inconsistency. Meanwhile, for the last stages of the multi-rate branches, Longstanding Inconsistency Excitation (LIE) module is constructed to perceive inter-group long-term temporal dynamics. Extensive experiments and visualizations conducted on four popular datasets demonstrate the effectiveness of the proposed method against state-of-the-art deepfake detection methods. © 2023 IEEE.","Deepfake detection; longstanding inconsistency; momentary inconsistency"
"Liang, P.; Liu, G.; Xiong, Z.; Fan, H.; Zhu, H.; Zhang, X.","Liang, Peifeng (59775033100); Liu, Gang (56403521800); Xiong, Zenggang (22636267500); Fan, Honghui (34871760900); Zhu, Hongjin (55637664700); Zhang, Xuemin (55715193100)","59775033100; 56403521800; 22636267500; 34871760900; 55637664700; 55715193100","A facial geometry based detection model for face manipulation using CNN-LSTM architecture","2023","https://www.scopus.com/inward/record.uri?eid=2-s2.0-85150044861&partnerID=40&md5=1ebee9494551bb9b3c516cfb837567f9","This issue of DeepFake technique that may cause great threat to privacy, democracy, and national security has attracted the attention of deep learning researchers. DeepFake detection, therefore, has been a very hot issue in deep learning research. The face landmark feature maps are often used by many DeepFake approaches in generating fake faces. It also provides key information to help to detect manipulated face images. In this paper, we propose a detection approach for manipulated face images. To make full use of face landmark information, we propose a facial geometry prior module (FGPM) to extract facial geometry feature maps. Then the facial geometry feature maps are embedded into upsampling feature maps generated by the CNN-LSTM network. The proposed FGPM exploits facial maps and frequency domain correlation to analyze the discriminative characteristics between manipulated and non-manipulated regions by incorporating the CNN-LSTM network. Finally, a decoder is used to learn the mapping from low-resolution feature maps to pixel-wise to predict manipulation localization. Or a softmax classifier is used to predict real or fake face images. By experimenting on several popular datasets, the proposed detection model has demonstrated the capability of localizing manipulation at the pixel level and with a high prediction on real or fake face images. © 2023","CNN-LSTM; DeepFake detection; Facial analysis; Facial geometry prior module; Resampling"
