"Authors","Author full names","Author(s) ID","Title","Year","Link","Abstract","Author Keywords"
"He, Z.; Guo, Z.; Wang, L.; Yang, G.; Diao, Y.; Ma, D.","He, Ziyuan (59925900300); Guo, Zhiqing (57219672095); Wang, Liejun (16833826600); Yang, Gaobo (8647279200); Diao, Yunfeng (57222760580); Ma, Dan (59925783500)","59925900300; 57219672095; 16833826600; 8647279200; 57222760580; 59925783500","WaveGuard: Robust Deepfake Detection and Source Tracing via Dual-Tree Complex Wavelet and Graph Neural Networks","2025","https://www.scopus.com/inward/record.uri?eid=2-s2.0-105020986670&partnerID=40&md5=f1e1fa362bf8d11229c7e006907184a4","Deepfake technology has great potential in the field of media and entertainment, but it also brings serious risks, including privacy disclosure and identity fraud. To counter these threats, proactive forensic methods have become a research hotspot by embedding invisible watermark signals to build active protection schemes. However, existing methods are vulnerable to watermark destruction under malicious distortions, which leads to insufficient robustness. Moreover, embedding strong signals may degrade image quality, making it challenging to balance robustness and imperceptibility. Although watermarked images look natural, their underlying structures are often different from the original images, which is ignored by traditional watermarking methods. To address these issues, this paper proposes a proactive watermarking framework called WaveGuard, which explores frequency domain embedding and graph-based structural consistency optimization. In this framework, the watermark is embedded into the high-frequency sub-bands by dual-tree complex wavelet transform (DT-CWT) to enhance the robustness against distortions and deepfake forgeries. By leveraging joint sub-band correlations and selected sub-band combinations, the framework enables robust source tracing and semi-robust deepfake detection. To enhance imperceptibility, we propose a Structural Consistency Graph Neural Network (SC-GNN) that constructs graph representations of the original and watermarked images to ensure structural consistency and reduce perceptual artifacts. Experimental results show that the proposed method performs exceptionally well in face swap and face replay tasks. © 1991-2012 IEEE.","Deepfake Detection; Frequency-domain Embedding; Graph Neural Network (GNN); Source Tracing"
"Erukude, S.T.; Marella, V.C.; Veluru, S.R.","Erukude, Sai Teja (59487510000); Marella, Viswa Chaitanya (60110797200); Veluru, Suhasnadh Reddy (60110890900)","59487510000; 60110797200; 60110890900","Fourier-Based GAN Fingerprint Detection Using ResNet50","2025","https://www.scopus.com/inward/record.uri?eid=2-s2.0-105020968105&partnerID=40&md5=5a955da0981bfbd0c968cab3fd7a921a","The rapid rise of photorealistic images produced from Generative Adversarial Networks (GANs) poses a serious challenge for image forensics and industrial systems requiring reliable content authenticity. This paper uses frequency-domain analysis combined with deep learning to solve the problem of distinguishing StyleGAN-generated images from real ones. Specifically, a two-dimensional Discrete Fourier Transform (2D DFT) was applied to transform images into the Fourier domain, where subtle periodic artifacts become detectable. A ResNet50 neural network is trained on these transformed images to differentiate between real and synthetic ones. The experiments demonstrate that the frequency-domain model achieves a 92.8 percent and an AUC of 0.95, significantly outperforming the equivalent model trained on raw spatial-domain images. These results indicate that the GAN-generated images have unique frequency-domain signatures or 'fingerprints'. The method proposed highlights the industrial potential of combining signal processing techniques and deep learning to enhance digital forensics and strengthen the trustworthiness of industrial AI systems. © 2025 IEEE.","Deepfake Detection; Frequency-Domain Analysis; Image Forensics; StyleGAN Fingerprints; Trustworthy AI Systems"
"Song, X.; Wu, C.; Liu, Z.","Song, Xiaohong (59529053200); Wu, Chuankun (7501669847); Liu, Zhuo (59529495300)","59529053200; 7501669847; 59529495300","SpectralFusionNet: Adaptive Frequency-Spatial Feature Fusion for Robust Deepfake Detection","2025","https://www.scopus.com/inward/record.uri?eid=2-s2.0-105018047395&partnerID=40&md5=6cf57967a053f11e8493a60bc1fdb6bd","With the rapid advancement of Generative Adversarial Networks (GANs), deepfake technology poses significant threats to social trust and information security, while current detection methods suffer from limited generalization ability, single feature dependency, and insufficient environmental robustness. To address these challenges, this paper proposes SpectralFusion-Net (SFN), a novel deepfake detection framework that adaptively fuses frequency domain and spatial domain. SFN introduces four key innovations: (1) An end-to-end fusion architecture enabling dynamic interaction between frequency-spatial domain features, (2) a frequency domain dynamic selection network that adaptively evaluates the importance of different frequency components, (3) a dual-channel attention fusion strategy for effective integration of complex frequency spectrum components, and (4) an adaptive frequency domain mask generation mechanism for flexible adaptation to different forgery types. Extensive experiments on DFFD and FaceForensics++ datasets demonstrate that SFN achieves superior performance with 96.05% average accuracy on FF++ and maintains 90.46% accuracy under heavy compression scenarios (c40), significantly outperforming existing methods in detection accuracy, generalization ability, and environmental robustness, particularly when facing unknown forgery types and low-quality images. © 2025 IEEE.","Attention mechanism; Deepfake detection; Feature fusion; Frequency domain analysis; Generative adversarial networks"
"Dutta, A.; Kumar das, A.K.; Naskar, R.; Chakra, R.S.","Dutta, Anurag (57820449400); Kumar das, Arnab (58264994300); Naskar, Ruchira (53866980700); Chakra, Rajat Subhra (60126927000)","57820449400; 58264994300; 53866980700; 60126927000","WaveDIF: Wavelet Sub-Band based Deepfake Identification in Frequency Domain","2025","https://www.scopus.com/inward/record.uri?eid=2-s2.0-105017846289&partnerID=40&md5=25e3a49c32a6741b8757607c50b2db66","With the more realistic convergence of Deepfakes, its' identification becomes more demanding. Recently, numerous deepfake detection techniques have been proposed, most of which are in the spatio-temporal domain. While these methods have shown promise, many of them neglect convincing artifacts that exhibit different patterns across frequency domains. This research proposes WaveDIF, a strict frequency domain, lightweight deepfake video detection algorithm using wavelet sub-band energies. In WaveDIF, for feature extraction, each video undergoes a Discrete Fourier Transform to filter out high-frequency noisy details (quite evident in deepfakes). These representations are then decomposed into their respective wavelet sub-bands -LL (Low-Low), LH (Low-High), HL (High-Low), and HH (High-High) passing them through a Haar Filter, following which the energy values (particular to each sub-band) are computed. These energy values are then used to learn a linear decision boundary (using regression analysis), which is then used for classification. This enables an interpretable, lightweight deterministic technique for the detection of synthesized videos, besides achieving an accuracy comparable to the state-of-the-art. Experimental results on popular deepfake video datasets shows over 92% accuracy for in-dataset evaluation, and 88% accuracy for cross dataset evaluation. © 2025 IEEE.","discrete fourier transform; discrete wavelet transform; frequency domain analysis; lightweight deepfake detection; wavelet sub-band energies"
"Liu, X.; Xiao, W.; Lin, X.; He, S.; Huang, C.; Guo, D.","Liu, Xianming (60118108300); Xiao, Wenrun (60117986400); Lin, Xiaofeng (59680665300); He, Shan (60117511700); Huang, Chao (58417295100); Guo, Donghui (60117986500)","60118108300; 60117986400; 59680665300; 60117511700; 58417295100; 60117986500","Deepfake Detection via Spatial-Frequency Attention Network","2025","https://www.scopus.com/inward/record.uri?eid=2-s2.0-105017314242&partnerID=40&md5=c37b3444363187c47cd60d674dec515e","Artificial Intelligence Generated Content (AIGC) makes creating realistic synthetic media a breeze. Facial forgery technologies threaten consumer electronics, such as smartphones, intelligent payment systems, and smart home Internet of Things (IoT) devices. These threats undermine identity authentication security and compromise user privacy. To address this problem, this paper introduces a wavelet-based Spatial and Frequency Domain Attention Network (SFANet) for deepfake detection. The SFANet comprises a wavelet transform-based feature decoupling module, a dual attention module, and a cross-modality fusion module. The spatial features are first decomposed into high and low-frequency components by wavelet transform. Subsequently, a dual attention mechanism is built to adjust frequency-domain weights dynamically. Finally, a cross-modality fusion module is introduced to integrate spatial and frequency-domain features for enhanced detection. Experimental results on three benchmark datasets, namely FaceForensics++, WildDeepfake, and Celeb-DF V2, prove that SFANet achieves superior detection performance compared to state-of-the-art models. This research provides a powerful tool to combat AI-driven misinformation and advances the field of synthetic content detection in consumer electronics. The implementation of SFANet will be publicly available at. © 1975-2011 IEEE.","Attention Mechanism; Cross-Domain Fusion; Deepfake Detection; Frequency Domain; Wavelet Transform"
"Li, Z.; Tang, W.; Gao, S.; Wang, Y.; Wang, S.","Li, Zifeng (59319982600); Tang, Wenzhong (36024278400); Gao, Shijun (59319890500); Wang, Yanyang (36127687700); Wang, Shuai (53983404200)","59319982600; 36024278400; 59319890500; 36127687700; 53983404200","Representation Alignment For Deepfake Detection","2025","https://www.scopus.com/inward/record.uri?eid=2-s2.0-105015865303&partnerID=40&md5=cccf2e3d3324bd892fac8a24fe2d1389","DeepFake detection faces growing challenges with the rapid advancement of generative models, enabling the creation of increasingly sophisticated forgeries. Existing methods often rely on heuristic features from spatial or frequency domains without effectively integrating them into backbone architectures to capture general forgery representations. To address this, we propose the Representation Alignment (RA) technique to enhance backbone design by incorporating high-quality external semantic features. By aligning intermediate representations, RA enables the detector to capture robust spatial attributes and discriminative frequency features, improving its ability to generalize across diverse forgery types. The proposed RA-enhanced Xception detector demonstrates superior performance in both within-domain and cross-domain evaluations. These results validate the effectiveness of RA in enhancing generalization and robustness, offering a lightweight and efficient approach for advancing DeepFake detection. ©2025 IEEE.","DeepFake Detection; Forgery generalization; Representation Alignment; Xception detector"
"Sharma, V.K.; Rawat, S.","Sharma, Vishal Kumar (57199918726); Rawat, Seema (56521132600)","57199918726; 56521132600","Enhancing Deepfake Detection Through Dynamics of Facial Expressions","2025","https://www.scopus.com/inward/record.uri?eid=2-s2.0-105013073675&partnerID=40&md5=30de418a8e7de90a2320f9a0c5812b6a","The rapid evolution of deepfake technology poses significant threats to digital security, media integrity, and public trust, necessitating the development of robust detection frame-works. Traditional deepfake detection methods primarily rely on pixel inconsistencies, frequency-domain analysis, or handcrafted features, but these approaches are increasingly vulnerable to advanced generative models that produce high-fidelity manipulations. In this study, we introduce MADDM, a Masked Autoencoder-based deepfake detection model that leverages facial expression dynamics to identify inconsistencies in muscle coordination - an aspect that remains challenging for deepfake generators to replicate accurately. Our model is trained in a self-supervised manner, first learning natural facial expressions from real datasets and then detecting anomalies in synthetic videos by reconstructing masked facial regions. Evaluations on Celeb-DF, DFDC, and FaceForensics++ datasets demonstrate that MADDM significantly outperforms existing detection methods, achieving an average accuracy of 81.1%, with state-of-the-art performance on Celeb-DF (86.3%). Further analysis through intra-dataset and cross-dataset testing confirms the model's superior generalization capabilities. The results highlight the potential of expression-based deepfake detection as a powerful and scalable solution for digital forensics and misinformation control. Future research should explore real-time implementation, transformer-based optimizations, and adversarial training strategies to enhance detection efficiency against evolving deepfake techniques. © 2025 IEEE.","convolutional neural network; deepfake detection; facial expressions analysis; masked auto encoders; spatio temporal"
"Maan, H.; Hooda, H.; Verma, H.; Kaushal, A.","Maan, Himanshu (60022961700); Hooda, Hemang (60023530100); Verma, Harshit (60023244200); Kaushal, Anukriti (58178665700)","60022961700; 60023530100; 60023244200; 58178665700","FALCON: Frequency-Aware Lightweight Convolutional Optimized Network","2025","https://www.scopus.com/inward/record.uri?eid=2-s2.0-105012162760&partnerID=40&md5=8e26070b87d6027c98a51394779fd261","The rise of deepfakes-images or videos that are manipulated using AI techniques like GANs-has created serious challenges in the areas of media trust, security, and online safety. Many existing methods for detecting deepfakes depend on visible image features or large, complex models like transformers. These models often struggle to detect newer types of deepfakes and require high computational power, which makes them hard to use on mobile or low-power devices. To address these issues, we propose FALCON (Frequency-Aware Lightweight Convolutional Optimized Network), a simple and efficient deep learning model for deepfake detection. The main goal of FALCON is to improve accuracy while keeping the model small and fast enough to run on real-time systems and low-resource devices. FALCON works in the frequency domain, where deepfakes often leave hidden traces. It uses three key techniques: High-Frequency Residual Injection (HFRI) to boost fake signals early in the network, Frequency Convolutional Layers (FCL) to analyze amplitude and phase patterns, and High-Frequency Refined Features (HFRF) to improve feature detection in deeper layers. We trained the model using techniques like mixed-precision, gradient clipping, and early stopping for better performance and stability. On the Kaggle 'Deepfake and Real Images' dataset, FALCON achieved 90% accuracy, 0.90 F1-score, and 0.97 AUC, outperforming other lightweight models. FALCON is ideal for real-time, reliable deepfake detection on everyday devices. This study highlights the effectiveness of frequency-domain learning as a practical and generalizable approach for deepfake detection. © 2025 IEEE.","Convolutional Neural Networks; Deep Learning; Deepfake Detection; Frequency Domain; High-Frequency Features"
"Liu, C.; Zhang, G.; Guo, S.; Li, Q.; Jeon, G.; Gao, M.","Liu, Changcun (59985636800); Zhang, Guisheng (57865198700); Guo, Siyou (59173914500); Li, Qilei (57202858223); Jeon, Gwanggil (15022497800); Gao, Mingliang (26634962800)","59985636800; 57865198700; 59173914500; 57202858223; 15022497800; 26634962800","Context-Aware Deepfake Detection for Securing AI-Driven Financial Transactions","2025","https://www.scopus.com/inward/record.uri?eid=2-s2.0-105010339808&partnerID=40&md5=eb51e693f6e06609779b9c5c6398cf92","The rapid advancement of deepfake technology has threatened the community’s sense of security, particularly in the context of face-based payment systems. Thus, deepfake detection has emerged as a critical issue demanding immediate attention. However, the generalization performance of existing detection models is limited as they are overly reliant on specific forged features while ignoring the common forged features. To address this problem, we introduce the context-aware decoupling network (CADNet) for deepfake detection. Specifically, a context self-calibration (CSC) module is constructed to guide the network to focus on local forged regions. It enlarges possible regions to increase the likelihood of forgery cues. Meanwhile, a frequency domain decoupling (FDD) module is introduced to extract and fuse different frequency components. It realizes the collaborative representation optimization of global semantics and local details. The experimental results prove that the proposed model exhibits strong generalization capability across multiple standard datasets. It achieves average area under the curve (AUC) values of 98.64% for in-domain evaluation and 75.52% for cross-dataset generalization. © 2014 IEEE.","Context self-calibration (CSC); deepfake detection; facial payment; frequency domain decoupling (FDD); generalization"
"Shi, Z.; Chen, H.; Jia, Y.; Zhang, D.; Lu, W.; Yang, X.","Shi, Zenan (57188923911); Chen, Haipeng (35753222600); Jia, Yixin (59920788300); Zhang, Dong (57201567643); Lu, Wei (57715097700); Yang, Xun (56537180500)","57188923911; 35753222600; 59920788300; 57201567643; 57715097700; 56537180500","Customized Transformer Adapter With Frequency Masking for Deepfake Detection","2025","https://www.scopus.com/inward/record.uri?eid=2-s2.0-105006898654&partnerID=40&md5=1e430ca137a569c37df2215e0fd87345","The rapid advancement of AI-generated content has intensified concerns over deepfakes due to increasingly sophisticated and visually convincing forgeries. To this end, the pre-trained Vision Transformer (ViT) model has become a de facto choice for deepfake detection, thanks to its powerful learning capability. Despite favorable results achieved by existing ViT-based methods, they have inherent limitations that could result in suboptimal performance in scenarios with continuously evolving forgery techniques, such as overfitting to single forgery patterns or placing excessive emphasis on dominant forgery regions. In this paper, we propose CUTA, a simple yet effective deepfake detection paradigm that utilizes ViT adapters as the medium and fully exploits the spatial- and frequency-domain features of given images to overcome the limitations of existing methods. Specifically, CUTA focuses on frequency domain masking within the input space, which obscures parts of the high-frequency image to intensify the training challenge while preserving subtle forgery cues in the frequency domain to facilitate comprehensive forgery representations. Furthermore, we propose two task-customized modules within the ViT model, i.e., the texture enhancement module and the multi-scale perceptron module, to seamlessly integrate local texture and rich contextual features. These two modules ensure an organic interaction between the task-specific forgery patterns and general semantic features within the pre-trained ViT framework. The experimental results on several publicly available benchmarks demonstrate CUTA’s superiority in performance, particularly showcasing its significant advantages in both cross-dataset and cross-manipulation scenarios. © 2005-2012 IEEE.","Deepfake detection; frequency domain masking; vision transformer; ViT adapter"
"Gu, S.; Qin, Z.; Xie, L.; Wang, Z.; Hu, Y.","Gu, Siqi (59156426900); Qin, Zihan (59462880900); Xie, Lizhe (36471460700); Wang, Zheng (57844595900); Hu, Yining (55768942900)","59156426900; 59462880900; 36471460700; 57844595900; 55768942900","Multiscale Features Integrated Model for Generalizable Deepfake Detection","2025","https://www.scopus.com/inward/record.uri?eid=2-s2.0-105001581289&partnerID=40&md5=e7e38bf59b4fa206bb59ef76af207ee5","Within the domain of Artificial Intelligence Generated Content (AIGC), technological strides in image generation have been marked, resulting in the proliferation of deepfake images that pose substantial security threats. The current landscape of deepfake detection technologies is marred by limited generalization across diverse generative models and a subpar detection rate for images generated through diffusion processes. In response to these challenges, this paper introduces a novel detection model designed for high generalizability, leveraging multiscale frequency and spatial domain features. Our model harnesses an array of specialized filters to extract frequency-domain characteristics, which are then integrated with spatial-domain features captured by a Feature Pyramid Network (FPN). The integration of the Attentional Feature Fusion (AFF) mechanism within the feature fusion module allows for the optimal utilization of the extracted features, thereby enhancing detection capabilities. We curated an extensive dataset encompassing deepfake images from a variety of GANs and diffusion models for rigorous evaluation. The experimental findings reveal that our proposed model achieves superior accuracy and generalization compared to existing baseline models when confronted with deepfake images from multiple generative sources. Notably, in cross-model detection scenarios, our model outperforms the next best model by a significant margin of 29.1% for diffusion-generated images and 15.1% for GAN-generated images. This accomplishment presents a viable solution to the pressing issues of generalization and adaptability in the field of deepfake detection. © © 2025 Siqi Gu et al. International Journal of Intelligent Systems published by John Wiley & Sons Ltd.","Artificial Intelligence Generated Content; deepfake detection; diffusion model; generative adversarial networks"
"Zhang, C.; He, X.; Shang, Z.","Zhang, Chunyue (59910215100); He, Xiping (26652968200); Shang, Zihan (59910056100)","59910215100; 26652968200; 59910056100","A method for detecting deepfake faces by integrating multi-scale deep-shallow spatial and frequency features","2024","https://www.scopus.com/inward/record.uri?eid=2-s2.0-105005834456&partnerID=40&md5=99c7251961b6740a01e249328effa50c","In recent years, deep learning technology has been excessively used in the creation of fake videos. Deepfake technology alters or replaces the facial information of the original video, synthesizes false voices, and is used to create pornographic films, fake news, political rumors, and so on, posing significant challenges to the authenticity of information and personal privacy. Currently, most face deepfake detection networks are based on single-scale and single-source detection research, and the proposed networks and methods often lack the ability to recognize unknown attack methods and generalization ability. To address these issues, this paper proposes a face deepfake detection method that integrates deep and shallow multi-scale spatial and frequency-domain features to achieve high-accuracy recognition of deepfake faces. The network is based on feature extraction from shallow and deep layers, where the shallow branch captures detailed information from low-level features to detect small-scale targets such as minor noise, while the deep branch focuses on detecting larger and higher-level fake features with a larger receptive field. Each branch adopts a method to fuse multi-scale spatial and frequency-domain features. Multi-scale features can capture information at different levels and granularities, while frequency-domain features can supplement fake traces that are difficult to detect in the spatial domain. Extensive experiments show that tthis framework outperforms most face spoofing detection networks and achieves good performance. © 2024 Copyright held by the owner/author(s).","Face deepfake detection, Multi-scale features Frequency domain features Feature fusion"
